<?xml version="1.0" encoding="UTF-8"?>
<!--Sample XML file generated by XMLSpy v2014 sp1 (x64) (http://www.altova.com)-->
<cers:RegulatorFacilityCreate xmlns:xsi="http://www.w3.org/2001/XMLSchema-instance" xmlns:cers="http://cersservices.calepa.ca.gov/Schemas/RegulatorFacilityCreate/1/06/" mode="Commit" xsi:schemaLocation="http://cersservices.calepa.ca.gov/Schemas/RegulatorFacilityCreate/1/06/ http://cersservices.calepa.ca.gov/Schemas/1/06/RegulatorFacilityCreate.xsd">
	<RegulatorTransactionKey>D49066C4-27F4-4630-947A-A775259B9790</RegulatorTransactionKey>
	<FacilityName>Mike's House</FacilityName>
	<FacilityAddress>
		<SiteAddress>1455 Stoney Cross Ln</SiteAddress>
		<City>Lincoln</City>
		<ZipCode>95648</ZipCode>
	</FacilityAddress>
	<IgnoreExactDuplicateAddressWarning>true</IgnoreExactDuplicateAddressWarning>
</cers:RegulatorFacilityCreate>
